{
 "schema_version": "1.0",
 "capture": "room_video",
 "tier": "video",
 "units": "metres",
 "rooms": [
  {
   "id": "room1",
   "polygon_m": [
    [
     -3.663,
     -1.416
    ],
    [
     -3.663,
     0.459
    ],
    [
     -2.264,
     0.459
    ],
    [
     -2.264,
     -0.091
    ],
    [
     -1.499,
     -0.091
    ],
    [
     -1.499,
     -1.416
    ]
   ],
   "walls": [
    {
     "id": "r1w0",
     "from": [
      -3.663,
      -1.416
     ],
     "to": [
      -3.663,
      0.459
     ],
     "length_m": {
      "value": 1.875,
      "ci95": [
       1.6,
       2.15
      ],
      "sigma": 0.1403
     },
     "plane_measured": false,
     "ends_measured": false
    },
    {
     "id": "r1w1",
     "from": [
      -3.663,
      0.459
     ],
     "to": [
      -2.264,
      0.459
     ],
     "length_m": {
      "value": 1.399,
      "ci95": [
       1.156,
       1.643
      ],
      "sigma": 0.1242
     },
     "plane_measured": false,
     "ends_measured": false
    },
    {
     "id": "r1w2",
     "from": [
      -2.264,
      0.459
     ],
     "to": [
      -2.264,
      -0.091
     ],
     "length_m": {
      "value": 0.55,
      "ci95": [
       0.343,
       0.757
      ],
      "sigma": 0.1056
     },
     "plane_measured": false,
     "ends_measured": false
    },
    {
     "id": "r1w3",
     "from": [
      -2.264,
      -0.091
     ],
     "to": [
      -1.499,
      -0.091
     ],
     "length_m": {
      "value": 0.765,
      "ci95": [
       0.553,
       0.977
      ],
      "sigma": 0.1081
     },
     "plane_measured": true,
     "ends_measured": false
    },
    {
     "id": "r1w4",
     "from": [
      -1.499,
      -0.091
     ],
     "to": [
      -1.499,
      -1.416
     ],
     "length_m": {
      "value": 1.325,
      "ci95": [
       1.084,
       1.566
      ],
      "sigma": 0.1229
     },
     "plane_measured": false,
     "ends_measured": false
    },
    {
     "id": "r1w5",
     "from": [
      -1.499,
      -1.416
     ],
     "to": [
      -3.663,
      -1.416
     ],
     "length_m": {
      "value": 2.164,
      "ci95": [
       1.868,
       2.46
      ],
      "sigma": 0.1512
     },
     "plane_measured": false,
     "ends_measured": false
    }
   ],
   "dimensions_m": {
    "along_x": {
     "value": 2.164,
     "ci95": [
      1.868,
      2.46
     ],
     "sigma": 0.1512,
     "ends_measured": false
    },
    "along_z": {
     "value": 1.875,
     "ci95": [
      1.6,
      2.15
     ],
     "sigma": 0.1403,
     "ends_measured": false
    }
   },
   "floor_area_m2": {
    "value": 3.64,
    "ci95": [
     3.15,
     4.12
    ],
    "sigma": 0.2466
   },
   "perimeter_m": 8.08,
   "ceiling_height_m": {
    "value": null,
    "ci95": [
     2.3,
     3.3
    ],
    "sigma": null,
    "status": "not_observed",
    "note": "capture did not see the ceiling over this room; prior range only"
   },
   "name": "Room 1"
  },
  {
   "id": "room2",
   "polygon_m": [
    [
     0.806,
     -0.835
    ],
    [
     -0.413,
     -0.835
    ],
    [
     -0.413,
     0.261
    ],
    [
     0.806,
     0.261
    ]
   ],
   "walls": [
    {
     "id": "r2w0",
     "from": [
      0.806,
      -0.835
     ],
     "to": [
      -0.413,
      -0.835
     ],
     "length_m": {
      "value": 1.219,
      "ci95": [
       0.982,
       1.456
      ],
      "sigma": 0.1209
     },
     "plane_measured": true,
     "ends_measured": false
    },
    {
     "id": "r2w1",
     "from": [
      -0.413,
      -0.835
     ],
     "to": [
      -0.413,
      0.261
     ],
     "length_m": {
      "value": 1.096,
      "ci95": [
       0.868,
       1.325
      ],
      "sigma": 0.1166
     },
     "plane_measured": true,
     "ends_measured": false
    },
    {
     "id": "r2w2",
     "from": [
      -0.413,
      0.261
     ],
     "to": [
      0.806,
      0.261
     ],
     "length_m": {
      "value": 1.219,
      "ci95": [
       0.982,
       1.456
      ],
      "sigma": 0.1209
     },
     "plane_measured": false,
     "ends_measured": false
    },
    {
     "id": "r2w3",
     "from": [
      0.806,
      0.261
     ],
     "to": [
      0.806,
      -0.835
     ],
     "length_m": {
      "value": 1.096,
      "ci95": [
       0.868,
       1.325
      ],
      "sigma": 0.1166
     },
     "plane_measured": false,
     "ends_measured": false
    }
   ],
   "dimensions_m": {
    "along_x": {
     "value": 1.219,
     "ci95": [
      0.982,
      1.456
     ],
     "sigma": 0.1209,
     "ends_measured": false
    },
    "along_z": {
     "value": 1.096,
     "ci95": [
      0.868,
      1.325
     ],
     "sigma": 0.1166,
     "ends_measured": false
    }
   },
   "floor_area_m2": {
    "value": 1.34,
    "ci95": [
     1.07,
     1.61
    ],
    "sigma": 0.1379
   },
   "perimeter_m": 4.63,
   "ceiling_height_m": {
    "value": null,
    "ci95": [
     2.3,
     3.3
    ],
    "sigma": null,
    "status": "not_observed",
    "note": "capture did not see the ceiling over this room; prior range only"
   },
   "name": "Room 2"
  },
  {
   "id": "room3",
   "polygon_m": [
    [
     -1.848,
     -0.091
    ],
    [
     -1.848,
     1.509
    ],
    [
     -2.089,
     1.509
    ],
    [
     -2.089,
     2.779
    ],
    [
     -0.618,
     2.779
    ],
    [
     -0.618,
     1.299
    ],
    [
     -0.317,
     1.299
    ],
    [
     -0.317,
     0.444
    ],
    [
     -1.469,
     0.444
    ],
    [
     -1.469,
     -0.091
    ]
   ],
   "walls": [
    {
     "id": "r3w0",
     "from": [
      -1.848,
      -0.091
     ],
     "to": [
      -1.848,
      1.509
     ],
     "length_m": {
      "value": 1.6,
      "ci95": [
       1.343,
       1.858
      ],
      "sigma": 0.1315
     },
     "plane_measured": true,
     "ends_measured": false
    },
    {
     "id": "r3w1",
     "from": [
      -1.848,
      1.509
     ],
     "to": [
      -2.089,
      1.509
     ],
     "length_m": {
      "value": 0.241,
      "ci95": [
       0.2,
       0.283
      ],
      "sigma": 0.0213
     },
     "plane_measured": false,
     "ends_measured": true
    },
    {
     "id": "r3w2",
     "from": [
      -2.089,
      1.509
     ],
     "to": [
      -2.089,
      2.779
     ],
     "length_m": {
      "value": 1.27,
      "ci95": [
       1.033,
       1.507
      ],
      "sigma": 0.1211
     },
     "plane_measured": true,
     "ends_measured": false
    },
    {
     "id": "r3w3",
     "from": [
      -2.089,
      2.779
     ],
     "to": [
      -0.618,
      2.779
     ],
     "length_m": {
      "value": 1.471,
      "ci95": [
       1.222,
       1.72
      ],
      "sigma": 0.127
     },
     "plane_measured": true,
     "ends_measured": false
    },
    {
     "id": "r3w4",
     "from": [
      -0.618,
      2.779
     ],
     "to": [
      -0.618,
      1.299
     ],
     "length_m": {
      "value": 1.48,
      "ci95": [
       1.23,
       1.73
      ],
      "sigma": 0.1274
     },
     "plane_measured": false,
     "ends_measured": false
    },
    {
     "id": "r3w5",
     "from": [
      -0.618,
      1.299
     ],
     "to": [
      -0.317,
      1.299
     ],
     "length_m": {
      "value": 0.301,
      "ci95": [
       0.102,
       0.501
      ],
      "sigma": 0.1017
     },
     "plane_measured": false,
     "ends_measured": false
    },
    {
     "id": "r3w6",
     "from": [
      -0.317,
      1.299
     ],
     "to": [
      -0.317,
      0.444
     ],
     "length_m": {
      "value": 0.855,
      "ci95": [
       0.639,
       1.071
      ],
      "sigma": 0.11
     },
     "plane_measured": false,
     "ends_measured": false
    },
    {
     "id": "r3w7",
     "from": [
      -0.317,
      0.444
     ],
     "to": [
      -1.469,
      0.444
     ],
     "length_m": {
      "value": 1.153,
      "ci95": [
       0.923,
       1.382
      ],
      "sigma": 0.1171
     },
     "plane_measured": false,
     "ends_measured": false
    },
    {
     "id": "r3w8",
     "from": [
      -1.469,
      0.444
     ],
     "to": [
      -1.469,
      -0.091
     ],
     "length_m": {
      "value": 0.535,
      "ci95": [
       0.329,
       0.742
      ],
      "sigma": 0.1054
     },
     "plane_measured": false,
     "ends_measured": false
    },
    {
     "id": "r3w9",
     "from": [
      -1.469,
      -0.091
     ],
     "to": [
      -1.848,
      -0.091
     ],
     "length_m": {
      "value": 0.379,
      "ci95": [
       0.177,
       0.58
      ],
      "sigma": 0.1027
     },
     "plane_measured": true,
     "ends_measured": false
    }
   ],
   "dimensions_m": {
    "along_x": {
     "value": 1.772,
     "ci95": [
      1.504,
      2.041
     ],
     "sigma": 0.1371,
     "ends_measured": false
    },
    "along_z": {
     "value": 2.87,
     "ci95": [
      2.573,
      3.167
     ],
     "sigma": 0.1515,
     "ends_measured": true
    }
   },
   "floor_area_m2": {
    "value": 3.64,
    "ci95": [
     3.23,
     4.04
    ],
    "sigma": 0.2068
   },
   "perimeter_m": 9.29,
   "ceiling_height_m": {
    "value": null,
    "ci95": [
     2.3,
     3.3
    ],
    "sigma": null,
    "status": "not_observed",
    "note": "capture did not see the ceiling over this room; prior range only"
   },
   "name": "Room 3"
  },
  {
   "id": "room4",
   "polygon_m": [
    [
     -4.111,
     2.514
    ],
    [
     -3.914,
     2.514
    ],
    [
     -3.914,
     2.779
    ],
    [
     -2.354,
     2.779
    ],
    [
     -2.354,
     1.615
    ],
    [
     -4.111,
     1.615
    ]
   ],
   "walls": [
    {
     "id": "r4w0",
     "from": [
      -4.111,
      2.514
     ],
     "to": [
      -3.914,
      2.514
     ],
     "length_m": {
      "value": 0.197,
      "ci95": [
       -0.001,
       0.395
      ],
      "sigma": 0.101
     },
     "plane_measured": false,
     "ends_measured": false
    },
    {
     "id": "r4w1",
     "from": [
      -3.914,
      2.514
     ],
     "to": [
      -3.914,
      2.779
     ],
     "length_m": {